{
  "schemaVersion": "0.1.0",
  "claimId": "claim_synthetic_disputed",
  "capability": "operations.kubernetes",
  "state": "disputed",
  "observedDepth": "exposure",
  "confidence": "low",
  "scope": "global",
  "projectRef": null,
  "basis": {
    "kind": "dispute",
    "evidenceRefs": ["evidence_synthetic_team_manifest"],
    "adjacentFrom": [],
    "rationale": null,
    "declarationRef": null,
    "correctionRef": "correction_synthetic_owner",
    "correctionSummary": "Developer identified the manifest as team-owned infrastructure"
  },
  "limitations": ["Original team evidence remains traceable but does not establish personal use"],
  "freshness": {
    "observedThrough": "2026-07-01T00:00:00Z",
    "stale": false
  }
}
